title,text
One dead in Czech cable car crash,"One person has died after a cable car became detached and plunged to the ground in the Czech Republic. The victim in Sunday's incident, on the Jested mountain in the north of the country, is believed to be a guide. He was the only person in the cabin. Fourteen people who were in a cabin travelling in the opposite direction were rescued by firefighters. An investigation has been launched into why the cabin came loose at the popular tourist destination. The cable route to the 1,012-metre (3,320ft) high Jested mountain near the city of Liberec uses two cabins, each operated manually by a member of staff. Last year, more than 210,000 people used the cable cars, according to the Lidove Noviny newspaper. Three arrested over fatal Italy cable car crash French Alps cable car tourists rescued Extreme weather events are 'the new norm' Scientists from the WMO say global warming is leading the world into ""uncharted territory"". Macron says Australian PM lied over submarine deal Migrants desperate for help camp on UN's doorstep. VideoMigrants desperate for help camp on UN's doorstep Can COP26 really save the planet? A really simple guide to climate change Migrants desperate for help camp on UN's doorstep. VideoMigrants desperate for help camp on UN's doorstep Three women, one cheating ex and an adventure. VideoThree women, one cheating ex and an adventure The film-school reject winning prizes and hearts Protecting Australia's lesser-known sacred rock. VideoProtecting Australia's lesser-known sacred rock What you can do to reduce emissions Can we stomach the latest emerging food innovations? The ancient martial art feared by the British Raj in India 15 sayings from around the world © 2021 BBC. The BBC is not responsible for the content of external sites. Read about our approach to external linking."
Libya: Thousands of migrants and refugees camp on UN's doorstep,"This video can not be played Up to 3,000 migrants and refugees have spent the past month camped out on the streets of Libya's capital, Tripoli, outside a community centre run by the United Nations. Many are desperate for help, after fleeing overcrowded detention centres. During one mass escape last month, six migrants were killed when guards opened fire. In this film, the BBC's international Correspondent Orla Guerin meets those on the streets, and asks what the UN refugee agency are doing about it. Camera: Dave Bull. Producer: Ahmed Edroughi. Senior Producer: Nick Springate. Video edited by: Alex Smith. Migrants desperate for help camp on UN's doorstep. Video, 00:02:36Migrants desperate for help camp on UN's doorstep Up Next. One migrant’s year-long attempt to cross the Channel. Video, 00:07:25One migrant’s year-long attempt to cross the Channel Risking death trying to get to England in a pedalo. Video, 00:07:06Risking death trying to get to England in a pedalo Handcuffed, blindfolded and beaten in Libya. Video, 00:09:30Handcuffed, blindfolded and beaten in Libya If Glasgow fails, then the whole thing fails - PM. Video, 00:02:33If Glasgow fails, then the whole thing fails - PM Biden: Russia and China 'didn't show up' on climate. Video, 00:00:58Biden: Russia and China 'didn't show up' on climate Passengers describe moment of Salisbury train crash. Video, 00:01:20Passengers describe moment of Salisbury train crash Three women, one cheating ex and an adventure. Video, 00:03:01Three women, one cheating ex and an adventure Protecting Australia's lesser-known sacred rock. Video, 00:03:20Protecting Australia's lesser-known sacred rock One-minute World News. Video, 00:01:04One-minute World News The Indian village that could disappear under water. Video, 00:02:53The Indian village that could disappear under water The moment train passengers flee Tokyo attack. Video, 00:00:47The moment train passengers flee Tokyo attack Swift performs at Rock and Roll Hall of Fame. Video, 00:01:46Swift performs at Rock and Roll Hall of Fame © 2021 BBC. The BBC is not responsible for the content of external sites. Read about our approach to external linking."
Tokyo knife and arson attack: The moment train passengers flee,"This video can not be played Video shows people trying to escape as smoke and flames fill a carriage during a knife and arson attack in Japan's capital. One man was left in a critical condition and more than 10 others injured in the attack on a major Tokyo train line on Sunday. The suspected attacker, a man in his 20s, was arrested at the scene. Read more: Several injured in Tokyo knife and arson attack The moment train passengers flee Tokyo attack. Video, 00:00:47The moment train passengers flee Tokyo attack Up Next. What happens when you try to swim in floating stone. Video, 00:00:49What happens when you try to swim in floating stone Firefighters battle Taiwan tower block blaze. Video, 00:00:45Firefighters battle Taiwan tower block blaze Our son was buried by mud - we couldn't save him. Video, 00:02:59Our son was buried by mud - we couldn't save him How protesters prepared for COP26 in Glasgow. Video, 00:02:33How protesters prepared for COP26 in Glasgow Why this element could help tackle climate change. Video, 00:02:32Why this element could help tackle climate change Sharks are my best friends. Video, 00:04:01Sharks are my best friends 'I want to feel as safe as men on public transport' Video, 00:02:58'I want to feel as safe as men on public transport' Michelle Wu makes history in Boston mayoral race. Video, 00:01:52Michelle Wu makes history in Boston mayoral race Halloween's over - what should I do with my costume? Video, 00:02:07Halloween's over - what should I do with my costume? One-minute World News. Video, 00:01:02One-minute World News Moment girl, 4, found after vanishing weeks ago. Video, 00:00:57Moment girl, 4, found after vanishing weeks ago 2021: A year of wild weather. Video, 00:01:522021: A year of wild weather Ardern: More needs to be done on climate change. Video, 00:02:09Ardern: More needs to be done on climate change © 2021 BBC. The BBC is not responsible for the content of external sites. Read about our approach to external linking."
FBI arrests suspected neo-Nazis ahead of Virginia gun rally,"The FBI has arrested three suspected members of a neo-Nazi hate group who planned to travel to a pro-gun rally in Virginia on Monday. One was a Canadian army reservist who was fired in August over ties to hate groups and has been suspected missing since, Canadian police told the BBC. Virginia governor Ralph Northam has declared a state of emergency in the city of Richmond ahead of the rally. He said law enforcement believed there was a threat of violence. Governor Northam on Thursday announced a ban on guns in the state's Capitol area in Richmond from Friday until Tuesday, citing threats of violence made ahead of the rally. The order also covers other weapons such as knives and sticks. He said some of the violent rhetoric seen online was reminiscent of that seen before the deadly Charlottesville rally in 2017, at which a 32-year-old counter protester, Heather Heyer, was killed by white nationalist James Fields. FBI in Baltimore, Maryland charged Brian Lemley, 33, and William Bilbrough, 19, with transporting and harbouring aliens. They charged Mr Lemley and Canadian Patrik Mathews with transporting a firearm and ammunition with intent to commit a felony. The FBI alleges that Mr Mathews entered the US illegally at the Manitoba/Minnesota border. All three are accused of being members of a white supremacist group known as The Base. According to the criminal complaint filed with the state's attorney general, The Base's members discussed in encrypted online chatrooms ""recruitment, creating a white ethno-state, committing acts of violence against minority communities (including African-Americans and Jewish-Americans), the organization's military-style training camps, and ways to make improvised explosive devices"". Monday's rally was planned by the Virginia Citizens Defence League (VCDL), a pro-gun-rights group, to protest gun control legislation that is expected to pass in the new year. VCDL said it was expecting 50,000 people to attend the protest. We have received credible intelligence from our law enforcement agencies of threats of violence surrounding the demonstration planned for Monday, January 20. This includes extremist rhetoric similar to what has been seen before major incidents, such as Charlottesville in 2017. Democrats won control of the Virginia state legislature last autumn, for the first time since 1994, and have made gun control a key part of their platform, especially in light of last summer's shooting at Virginia Beach, which killed 12. Mr Northam, who is also a Democrat and has been governor since 2017, tried to get gun control measures passed to no avail this summer, before the election. Mr Mathews was a combat engineer in the Canadian Army Reserve, but he was fired in late August after an nundercover reporter for the Winnipeg Free Press connected him to The Base and alleged he was trying to recruit new members. ""We're real (expletive) Nazis and they can't do s—- to us but wait for us to put em against the wall,"" Mr Mathews allegedly wrote in an online encrypted chatroom. Police raided Mr Matthews' home shortly after the report and seized a number of firearms. He subsequently disappeared, and RCMP were still looking for him on 2 September, when they found his car abandoned about five miles (8 km) away from the Minnesota border. Four dates that explain the US gun debate 'A battle for the soul of America' Twelve killed in mass shooting in Virginia A reckoning in Charlottesville Biden attacks China and Russia for missing COP26 The US president calls the Chinese leader's absence from the Glasgow summit a ""big mistake"". Missing girl found alive weeks after vanishing Fury at Auschwitz tattoo stamp sale in Jerusalem Revealed: The Cryptoqueen's £13.5m London penthouse What's the climate impact of private jets at COP26? When cheering a cricket win can land you in jail How many trees has the world been cutting down? Border closures threaten Hong Kong's hub status Job-seekers turn to TikTok to post 'CareerTok' CVs Bosnian leader stokes fears of Balkan breakup BBC Travel: The city where you can't serve meat Behind the scenes at COP26. VideoBehind the scenes at COP26 15 sayings from around the world © 2021 BBC. The BBC is not responsible for the content of external sites. Read about our approach to external linking."
Sudan coup: Khartoum barricaded by pro-democracy activists,"This video can not be played Sudanese protesters have barricaded roads in the capital, Khartoum, as part of week-long demonstrations against a military coup. Three people were killed on Saturday when security forces fired shots and tear gas to disperse protesters in the nearby city of Omdurman, medics said. The interior ministry denied that live rounds had been fired. The army seized power on Monday, detaining Prime Minister Abdalla Hamdok and other civilian leaders. The UN's Sudan envoy, Volker Perthes, met Mr Hamdok at his residence on Sunday. Mr Perthes said Mr Hamdok was well but remained under house arrest. ""We discussed options for mediation and the way forward for Sudan,"" he added. Coup leader Gen Abdel Fattah Burhan dissolved civilian rule on Monday. The general, who also called a state of emergency, said his actions were justified to avoid ""civil war"" and stop political infighting. The military takeover has drawn widespread international condemnation. Saturday saw the biggest demonstrations yet, with tens of thousands marching across the country with Sudanese flags and chanting, ""No to military rule!"" ""These protests are going to continue being peaceful even when faced with the guns,"" Shaheen al Shaheef, a member of the Khartoum Resistance Committee, told the BBC. More than 10 protesters have died in clashes with security forces last week. The Sudanese authorities have cut off the internet and other communications. Until Monday's coup, civilian and military leaders had been in an uneasy power-sharing agreement since long-time ruler Omar al-Bashir was overthrown in 2019. The deal was designed to steer Sudan towards democracy, but it proved to be fragile with a number of previous coup attempts. Gen Burhan, who was head of the power-sharing council, said Sudan was still committed to the transition to civilian rule, with elections planned for July 2023. Africa Today podcasts Extreme weather events are 'the new norm' Scientists from the WMO say global warming is leading the world into ""uncharted territory"". Macron says Australian PM lied over submarine deal Migrants desperate for help camp on UN's doorstep. VideoMigrants desperate for help camp on UN's doorstep The challenges that COP26 needs to tackle A really simple guide to climate change Migrants desperate for help camp on UN's doorstep. VideoMigrants desperate for help camp on UN's doorstep Three women, one cheating ex and an adventure. VideoThree women, one cheating ex and an adventure The film-school reject winning prizes and hearts Protecting Australia's lesser-known sacred rock. VideoProtecting Australia's lesser-known sacred rock What you can do to reduce emissions Can we stomach the latest emerging food innovations? The ancient martial art feared by the British Raj in India 15 sayings from around the world © 2021 BBC. The BBC is not responsible for the content of external sites. Read about our approach to external linking."
