title,text
How film-school reject Khadar Ahmed is winning prizes and hearts,"By Damian ZaneBBC News The prize-winning film The Gravedigger's Wife looks like the work of a seasoned director, yet it is Khadar Ahmed's debut feature. Its pacing, timing and beauty show a confidence belying the 40-year-old's lack of experience. He fled Somalia's civil war with his family and ended up in Finland aged 16 - and has never made it to film school. ""God knows how many times I applied for film school but never got in,"" he told the BBC. Yet promoting Somali-language film has become a goal - to show his culture and roots on screen. For Ahmed, winning the top prize last month at Africa's prestigious Fespaco film festival proves that dramas in his mother tongue can cross borders. The Gravedigger's Wife is a tender love story with dark comic flashes about the lengths a person can go to in order to save someone they love. The gravedigger - Guled, played by Omar Abdi - sits outside hospital with his comrades, shovel in hand, waiting for a patient to die. Ironically, it is only through these deaths that he can make money to help keep his sick wife, Nasra, alive. Played by Yasmin Warsame, she is dying of kidney failure. The enormous cost of life-saving treatment forces Guled to make some extreme decisions. This simple, pared-down story, filmed with long silences and expansive landscapes, is nothing like the tales that Ahmed grew up with. He recalls a diet of Bollywood films filled with music and dancing and happy-ever-after endings. ""I had no reference for this film, I had no film that I could compare this to,"" Ahmed says. ""So I had to create my vision of how I see it."" In fact, he cannot remember ever seeing a professionally made Somali film at the cinema. His mother was in tears throughout the entire screening when The Gravedigger's Wife premiered at the Cannes Film Festival in July. ""She was so overwhelmed,"" he says. ""There are so many generations who have never had the pleasure and opportunity to see themselves on the big screen. I wanted to create that."" The Gravedigger's Wife is set, and was filmed on location, in Djibouti, which neighbours Somalia, but it has not yet been shown in the region. A large audience of Somalis, and people of Somali heritage, did get to see it at September's Toronto International Film Festival. ""They all felt a sense of pride. It was a joy to watch them enjoy it and then come up to me afterwards,"" Ahmed says. The director also hopes that his path to making the film could serve as an inspiration. He never went to film school, nor received any formal directorial training and has never worked on anyone else's film set. His journey began a decade ago when he wrote the first draft of the screenplay. He was so determined that he would direct it himself in Somali that he put it to one side to learn the craft in part by absorbing the ideas of the films he loved. After watching Bollywood, he turned to cinema from all over the world, including South Korea and Iran. But his biggest influence has been films made on the African continent. He especially admires the work of Mauritanian Abderrahmane Sissako, who was the chairman of the Fespaco prize jury. Chadian director Mahamat-Saleh Haroun has also had an impact on Ahmed, and he remembers crying at the beauty of his 2010 film A Screaming Man. After studying these films and trying to understand the techniques, he directed two short films and wrote a screenplay in Finnish before he felt able to take on The Gravedigger's Wife. Now he is left wondering if he had gone to film school whether the experience would have changed him for better or worse. ""I want to encourage young African film-makers, non-privileged film-makers, to really grab cameras and do their own stuff. Write their own stories, capture their own lives and do it on their own, because not everyone's so privileged."" He himself is determined to carry on making films in Africa: ""I hail from the continent and I believe that the future of cinema is in Africa. There are so many stories that cannot be set in Western countries."" He believes the precariousness of life and the dilemmas that people like his fictional gravedigger face are what can make great drama. But when it comes to genre, he is eager to explore the possibilities. ""I want to make comedy, I want to make sci-fi, I want to make Westerns, horror films and thrillers,"" he says. The Fespaco award may help him do this, but for now after years of honing his vision ""having the film made was the biggest prize"". ""I'm just really happy that all this is happening for the film."" A quick guide to Somalia Africa Today podcasts Extreme weather events are 'the new norm' Scientists from the WMO say global warming is leading the world into ""uncharted territory"". Macron says Australian PM lied over submarine deal Migrants desperate for help camp on UN's doorstep. VideoMigrants desperate for help camp on UN's doorstep Can COP26 really save the planet? A really simple guide to climate change Migrants desperate for help camp on UN's doorstep. VideoMigrants desperate for help camp on UN's doorstep Three women, one cheating ex and an adventure. VideoThree women, one cheating ex and an adventure The film-school reject winning prizes and hearts Protecting Australia's lesser-known sacred rock. VideoProtecting Australia's lesser-known sacred rock What you can do to reduce emissions Can we stomach the latest emerging food innovations? The ancient martial art feared by the British Raj in India 15 sayings from around the world © 2021 BBC. The BBC is not responsible for the content of external sites. Read about our approach to external linking."
G20 pledge climate action but make few commitments,"The leaders of the world's richest economies have agreed to pursue efforts to limit global warming with ""meaningful and effective actions"". But the agreement from the G20 summit in Rome made few concrete commitments, disappointing activists. Host nation Italy had hoped that firm targets would be set before the COP26 summit in Glasgow, which has now begun. UK PM Boris Johnson, who is hosting COP26 said leaders' promises without action were ""starting to sound hollow"". ""These commitments... are drops in a rapidly warming ocean,"" Mr Johnson said. This video can not be played US President Joe Biden said there were a ""series of very productive meetings"" at the G20, adding that he was ""looking forward to continuing to make progress"" on climate issues in Glasgow. He also said China and Russia - who are among the world's biggest polluters - ""basically didn't show up"" on matters of the climate, which was ""disappointing"". The G20 group, made up of 19 countries and the European Union, accounts for 80% of the world's emissions. The communiqué, or official statement released by the leaders, also makes no reference to achieving net zero by 2050. Net zero means reducing greenhouse gas emissions as much as possible, until a country is absorbing the same amount of emissions from the atmosphere that it is putting out. Italian Prime Minister Mario Draghi did however say in his closing statement that all of the G20 countries are committed to reaching the target by the mid-century. Scientists say this must be achieved by 2050 to avoid a climate catastrophe, and most countries have agreed to this. However China - the world's biggest polluter - and Russia have pushed that target out to 2060. Neither China's President Xi Jinping, nor Russia's Vladimir Putin were in Rome for the conference, instead joining via video link. Their absence raised concerns that a deal would not be easy to reach. Mr Putin said his plan was to ""not just to reach carbon neutrality, but to make sure that within the next three decades, the amount of greenhouse gas emissions in Russia is lower than, for instance, that of our neighbours and colleagues in the EU."" The communiqué does pledge to stop financing new, unabated coal plants internationally by the end of this year - a strong message to coal-reliant nations such as China, Russia and India. But the G20 leaders stopped short of agreeing to end coal power in their own nations. Mr Draghi said that they were closer to reaching the goal of providing $100bn a year in climate financing to developing countries - a key pledge which has been pushed out to 2023. António Guterres, the UN's secretary-general, tweeted that he was leaving Rome with his ""hopes unfulfilled"" but not buried. While I welcome the #G20's recommitment to global solutions, I leave Rome with my hopes unfulfilled — but at least they are not buried. Onwards to #COP26 in Glasgow to keep the goal of 1.5 degrees alive and to implement promises on finance and adaptation for people & planet. pic.twitter.com/c1nhIDbA8m Mr Johnson said it had been a ""reasonable"" G20, with some progress made, but there was still so much work to do that ""right now, the Paris agreement and the hope that came with it is just a piece of paper"". Leaders are due to leave Rome and arrive in Glasgow on Sunday night ahead of their high-level climate talks on Monday at COP26. Mr Johnson had a gloomy message ahead of the conference: ""If Glasgow fails, then the whole thing fails."" Activists had expressed their disappointment over the communiqué, feeling it was not tough enough. Oscar Soria, of the activist network Avaaz, told the agency there was ""little sense of urgency"" coming from the group, adding: ""There is no more time for vague wish-lists, we need concrete commitments and action."" However, others have been keen to paint the G20 as a stepping stone to COP26, which will see delegates from nearly 200 countries gather to discuss cutting carbon emissions. A US official told reporters the G20 was about ""helping build momentum"" before the leaders head to Glasgow, while France's President Emmanuel Macron told newspaper Journal du Dimanche that ""nothing is ever written before a COP"". This video can not be played On Saturday, the first day of the two-day summit, focus was on Covid and the economy, with an agreement being reached on a global tax rate which will see the profits of large businesses taxed at least 15%. It follows concern that multinational companies are re-routing their profits through low tax jurisdictions. After years of talking, the planet is now at least 1.1C hotter than the pre-industrial level. Climate scientist want warming restricted to 1.5C to prevent climate catastrophe. Read more about the COP26 summit here. Why China's climate policy matters to us all What action are the biggest carbon polluters taking? 'Moment of truth' as world meets at climate summit Extreme weather events are 'the new norm' Scientists from the WMO say global warming is leading the world into ""uncharted territory"". Macron says Australian PM lied over submarine deal Migrants desperate for help camp on UN's doorstep. VideoMigrants desperate for help camp on UN's doorstep Can COP26 really save the planet? A really simple guide to climate change Migrants desperate for help camp on UN's doorstep. VideoMigrants desperate for help camp on UN's doorstep Three women, one cheating ex and an adventure. VideoThree women, one cheating ex and an adventure The film-school reject winning prizes and hearts Protecting Australia's lesser-known sacred rock. VideoProtecting Australia's lesser-known sacred rock What you can do to reduce emissions Can we stomach the latest emerging food innovations? The ancient martial art feared by the British Raj in India 15 sayings from around the world © 2021 BBC. The BBC is not responsible for the content of external sites. Read about our approach to external linking."
Igor Kirillov: TV man known as the face of the USSR dies at 89,"By Steve RosenbergBBC News, Moscow Igor Kirillov - the man known as the face and voice of the USSR for three decades - has died in Russia aged 89. Kirillov was Soviet TV's chief newsreader and announcer. With his trademark delivery - unhurried and calm - he informed viewers of the first sputnik in space, and delivered the communiqués of the Communist Party. He also anchored all major Soviet set-piece events: from Moscow's Red Square parades to communist congresses. The Soviet Union collapsed in 1991. Positive stories dominated Soviet news bulletins. Every year, to images of combine harvesters advancing through the fields, Igor Kirillov would declare the grain harvest a triumph. But did he believe it? ""For me the hardest thing of all was to believe what I was reading out,"" Igor Kirillov told me in an interview in 2011. ""Deep down I knew that the texts contained half-truths. But as a newsreader you had to convince yourself it was the complete truth. And I did. I persuaded myself that we really were building communism. That life really would get better. Any doubts I had I managed to overcome. If I hadn't then I wouldn't have been able to do my job."" The news wasn't always good. In the 1980s Soviet leaders got into the nasty habit of dying in rapid succession. It was a sombre Igor Kirillov who informed the country of their passing. It happened so often, in fact, that it sparked this famous Soviet joke: Igor Kirillov goes on air in a black tie and announces: ""Comrades, you're going to laugh, but another irreplaceable leader needs replacing."" He had trained as an actor. So how did he break into television? ""At the job interview, I played the guitar and sang,"" he told me. ""Then they asked me to read something out. Luckily the night before I'd memorised a copy of the newspaper Pravda. So I recited that, right off the top of my head. Afterwards as I was leaving the building, the chief stopped me. 'Where are you going?' he said. 'You've got the job and you're on air in two hours'."" The communist newscaster had other jobs, too. He presented Soviet TV's version of Top of the Pops. It was a little more Lenin than Paul McCartney. In 1985 he became a global chart-topper, with a little help from Sting, whose hit song Russians kicks off with Igor Kirillov's voice reading the news. By the late 1980s television news was changing around the world. Journalists were replacing professional announcers as newsreaders. The USSR was no exception.  Soviet TV revamped its nightly news. In came reporters… out went the ""dyktory"". In 1990, during a study year in Moscow, I interviewed Igor Kirillov for a university project. The Soviet Union's most famous announcer was having a difficult time. ""I read the news for 20 two years on the nightly news Vremya,"" he told me. ""Now they've decided not to use 'diktory'. There's a condescending, disdainful attitude now towards announcers."" He thought that journalists who became anchors delivered the news too fast. ""Russians don't like fast talking. They have their own way of conversing: in a calm, unhurried, thoughtful way. ""If TV news goes in one ear and out the other, our heads will be empty."" Soviet Union timeline Mikhail Gorbachev: The man who lost an empire Extreme weather events are 'the new norm' Scientists from the WMO say global warming is leading the world into ""uncharted territory"". Macron says Australian PM lied over submarine deal Migrants desperate for help camp on UN's doorstep. VideoMigrants desperate for help camp on UN's doorstep The challenges that COP26 needs to tackle What the COP26 climate summit could mean for us all Migrants desperate for help camp on UN's doorstep. VideoMigrants desperate for help camp on UN's doorstep Three women, one cheating ex and an adventure. VideoThree women, one cheating ex and an adventure The film-school reject winning prizes and hearts Protecting Australia's lesser-known sacred rock. VideoProtecting Australia's lesser-known sacred rock What you can do to reduce emissions Can we stomach the latest emerging food innovations? The ancient martial art feared by the British Raj in India 15 sayings from around the world © 2021 BBC. The BBC is not responsible for the content of external sites. Read about our approach to external linking."
Biden at G20: Russia and China 'didn't show up' on climate,"This video can not be played US President Joe Biden has addressed disappointment by some about what was agreed at the G20 ahead of COP26. Speaking in Rome, Mr Biden said China and Russia ""basically didn't show up"" on matters of the climate. Neither China's President Xi Jinping, nor Russia's Vladimir Putin, were in Italy's capital for the conference, instead joining via video link. Read more: G20 pledge climate action but make few commitments More on the climate summit Biden: Russia and China 'didn't show up' on climate. Video, 00:00:58Biden: Russia and China 'didn't show up' on climate Up Next. COP26 is the last chance saloon - Prince Charles. Video, 00:00:45COP26 is the last chance saloon - Prince Charles If Glasgow fails, then the whole thing fails - PM. Video, 00:02:33If Glasgow fails, then the whole thing fails - PM Greta: It's never too late to do as much as we can. Video, 00:00:48Greta: It's never too late to do as much as we can Limiting temperature rise to 1.5C 'very tough' Video, 00:01:26Limiting temperature rise to 1.5C 'very tough' 'Show consideration' during climate protests. Video, 00:01:17'Show consideration' during climate protests Migrants desperate for help camp on UN's doorstep. Video, 00:02:36Migrants desperate for help camp on UN's doorstep Joyful reunions as Australia's border opens. Video, 00:01:31Joyful reunions as Australia's border opens The pumpkins taking a dive this Halloween. Video, 00:00:28The pumpkins taking a dive this Halloween Three women, one cheating ex and an adventure. Video, 00:03:01Three women, one cheating ex and an adventure One-minute World News. Video, 00:01:00One-minute World News UN chief: We're digging our own graves on climate. Video, 00:01:39UN chief: We're digging our own graves on climate Passengers describe moment of Salisbury train crash. Video, 00:01:20Passengers describe moment of Salisbury train crash Protecting Australia's lesser-known sacred rock. Video, 00:03:20Protecting Australia's lesser-known sacred rock © 2021 BBC. The BBC is not responsible for the content of external sites. Read about our approach to external linking."
Fishing row: Jersey fisherman want fishing areas closed,"The Jersey Fisherman's Association (JFA) has called on the government to close its fishing areas to all vessels. The group wants several of the fisheries closed for six weeks and demanded the declassification of its waters be removed. It comes as tensions rose in the past week over rights of French fishing boats to work in UK waters. It led to France warning that it could cut electricity supplies to Jersey as it previously threatened in May. France was angered by a decision from the UK and Jersey in September to deny fishing licences to dozens of French boats and argued this breached the Brexit deal. It then warned it would tighten checks on UK boats and trucks if the dispute over fishing licences was not resolved by Tuesday. France has also said it could block its ports to British vessels in retaliation. Jersey's government said this week it was ""extremely disappointed"" at the French stance. On Friday the JFA met with government ministers and has since written proposals in respect of the threats by France. Don Thompson, the president of the JFA, said in a letter: ""We now have a situation where our local fleet are tied up as Jersey's fish exporters are prevented from accessing European markets and our fishermen are unable to land into France. ""At the same time we watch as French vessels continue to fish with licenses valued at £14 million (issued free of charge by Jersey) in Jersey waters, on Jersey's fish stocks and land back into France without constraint. ""This situation, we have stated is entirely unacceptable."" The letter called on Jersey's government to take a number of measures with revocation of all licences to be considered ""only as a last resort"". The States has been contacted for comment. Follow BBC Jersey on Twitter and Facebook. Send your story ideas to channel.islands@bbc.co.uk. Jersey offers 162 fishing licences after ultimatum Turbulence has hit relations with France, PM says Who really owns UK fishing rights? Up to France to end fishing row, says UK Restrict public access so ‘wildlife can be left alone’ UK warns it may carry out checks on EU fishing vessels Why France and UK are fighting over fishing - and how a trade war could erupt One in three islanders with covid aged under 19 Fishing tensions rise as France charges UK trawlerman over licence Condor moves French sailings to blacklisted port over winter Information about BBC links to other news sites Summit is last, best hope to hit climate target - COP26 chief As the climate summit begins, Alok Sharma says the window of opportunity to avoid disaster is closing. 'Window closing' on 1.5C target - Alok Sharma G20 pledge climate action but make few commitments Can COP26 really save the planet? ‘As a child I saw the plane crash that killed my sisters' Life where it's too hot to work, too hot to sleep How the Taliban takeover changed my life 'I want to give my autistic son a voice' Tiny pumpkins a smash hit for glassmaker. VideoTiny pumpkins a smash hit for glassmaker A lifetime with the Yanomami. VideoA lifetime with the Yanomami Jailed three times for refusing to join the army. VideoJailed three times for refusing to join the army The Tantra teacher giving millennials 'orgasms' in Singapore 15 sayings from around the world © 2021 BBC. The BBC is not responsible for the content of external sites. Read about our approach to external linking."
'Father of tiramisu' Ado Campeol dies aged 93,"Restaurateur Ado Campeol, dubbed ""the father of Tiramisu"" by Italian media, has died aged 93. Campeol was the owner of Le Beccherie, a restaurant in Treviso in northern Italy where the famous dessert was invented by his wife and a chef. The dish, featuring coffee-soaked biscuits and mascarpone, was added to their menu in 1972 but never patented by the family. It has since become a staple of Italian cuisine, adapted by chefs worldwide. There have been long-running disputes about the origin of tiramisu, including claims that it was served as an aphrodisiac at a brothel in the north Italian city of Trevisio. However it is widely accepted the recipe was developed in Campeol's restaurant in the city. Luca Zaia, governor of the Veneto region, was among those who paid respects, tweeting that the city had ""[lost] another star in its food and wine history"". Le Beccherie was opened by Campeol's family in 1939, and Campeol took over the business at the end of World War Two. According to the dessert's co-inventor, Chef Roberto Linguanotto, the dish was the result of an accident while making vanilla ice cream. Mr Linguanotto dropped some mascarpone cheese into a bowl of eggs and sugar, and after he noticed the mixture's pleasant taste, he told Campeol's wife Alba. The pair then perfected the dessert by adding ladyfinger sponges soaked in coffee, and sprinkling it with cocoa - calling it ""Tiramisù"", which translates into English as ""pick me up"". The dish appeared in print in a 1981 issue of Veneto, a local publication dedicated to food and wine, and it is now one of Italy's best known desserts. Variants of tiramisu feature alcohol like rum or marsala, but the original recipe - certified by the Italian Academy of Cuisine in 2010 - was alcohol-free because it was intended to be child-friendly. Extreme weather events are 'the new norm' Scientists from the WMO say global warming is leading the world into ""uncharted territory"". Macron says Australian PM lied over submarine deal Migrants desperate for help camp on UN's doorstep. VideoMigrants desperate for help camp on UN's doorstep Can COP26 really save the planet? A really simple guide to climate change Migrants desperate for help camp on UN's doorstep. VideoMigrants desperate for help camp on UN's doorstep Three women, one cheating ex and an adventure. VideoThree women, one cheating ex and an adventure The film-school reject winning prizes and hearts Protecting Australia's lesser-known sacred rock. VideoProtecting Australia's lesser-known sacred rock What you can do to reduce emissions Can we stomach the latest emerging food innovations? The ancient martial art feared by the British Raj in India 15 sayings from around the world © 2021 BBC. The BBC is not responsible for the content of external sites. Read about our approach to external linking."
